{
  "$schema": "https://json-schema.org/draft/2020-12/schema",
  "$id": "buildings.schema.json",
  "type": "array",
  "items": {
    "type": "object",
    "required": ["building_id", "name"],
    "properties": {
      "building_id": { "type": "string", "minLength": 1 },
      "name": { "type": "string", "minLength": 1 },
      "category": { "type": "string" },
      "description": { "type": "string" },
      "lat": { "type": "number" },
      "lng": { "type": "number" },
      "source_id": { "type": "string" },
      "source_url": { "type": "string" },
      "last_verified_at": { "type": "string" }
    },
    "additionalProperties": false
  }
}
