[
  {
    "building_id": "ampliamento-polifunzionale",
    "last_verified_at": "2026-04-09T19:53:21.690513+00:00",
    "lat": 39.356074,
    "lng": 16.230362,
    "name": "Ampliamento polifunzionale",
    "source_id": "unical-campus-map",
    "source_url": "https://www.unical.it/campus/visita-il-campus/mappa/"
  },
  {
    "building_id": "anfiteatro-polifunzionale",
    "last_verified_at": "2026-04-09T19:53:21.690513+00:00",
    "lat": 39.3561975,
    "lng": 16.231007,
    "name": "Anfiteatro polifunzionale",
    "source_id": "unical-campus-map",
    "source_url": "https://www.unical.it/campus/visita-il-campus/mappa/"
  },
  {
    "building_id": "auditorium-teatro-grande",
    "description": "Teatro Auditorium Unical (TAU) in Piazza Vermicelli, all'estremità nord del Campus. Ampio spazio scenico per concerti, teatro classico o di avanguardia e opere liriche. Capienza 550 posti. Dispone di botteghini, guardaroba, caffetteria bistrot, buca dell'orchestra per 60 orchestrali e 12 camerini doppi e multipli. Per richiedere l'utilizzo degli spazi: dir.cams@unical.it.",
    "last_verified_at": "2026-04-13T16:48:30.059902+00:00",
    "lat": 39.3676094,
    "lng": 16.2254199,
    "name": "Auditorium Teatro Grande",
    "source_id": "unical-services",
    "source_url": "https://www.unical.it/campus/vivere-il-campus/teatri-e-cinema/tau/"
  },
  {
    "building_id": "aula-magna",
    "description": "Aula Magna \"Beniamino Andreatta\" del Centro Congressi, dotata di 660 posti, sistema di videoproiezione, PC, impianto audio, microfoni fissi e palmari, illuminazione, climatizzazione e due postazioni reception con connessione internet e rete telefonica.",
    "last_verified_at": "2026-04-13T16:48:30.059902+00:00",
    "lat": 39.3583149,
    "lng": 16.2258276,
    "name": "Aula Magna",
    "source_id": "unical-services",
    "source_url": "https://www.unical.it/campus/vivere-il-campus/centro-congressi/"
  },
  {
    "building_id": "aula-magna-convegno-societa-italiana-di-fisica",
    "last_verified_at": "2026-04-09T19:53:21.690513+00:00",
    "lat": 39.3581846,
    "lng": 16.2256829,
    "name": "Aula Magna - Convegno Società Italiana di Fisica",
    "source_id": "unical-campus-map",
    "source_url": "https://www.unical.it/campus/visita-il-campus/mappa/"
  },
  {
    "building_id": "capannone-c",
    "last_verified_at": "2026-04-09T19:53:21.690513+00:00",
    "lat": 39.3580204,
    "lng": 16.2304625,
    "name": "Capannone C",
    "source_id": "unical-campus-map",
    "source_url": "https://www.unical.it/campus/visita-il-campus/mappa/"
  },
  {
    "building_id": "capannone-d",
    "last_verified_at": "2026-04-09T19:53:21.690513+00:00",
    "lat": 39.3582651,
    "lng": 16.2308648,
    "name": "Capannone D",
    "source_id": "unical-campus-map",
    "source_url": "https://www.unical.it/campus/visita-il-campus/mappa/"
  },
  {
    "building_id": "capannone-e",
    "last_verified_at": "2026-04-09T19:53:21.690513+00:00",
    "lat": 39.3579188,
    "lng": 16.2318707,
    "name": "Capannone E",
    "source_id": "unical-campus-map",
    "source_url": "https://www.unical.it/campus/visita-il-campus/mappa/"
  },
  {
    "building_id": "capannone-f",
    "last_verified_at": "2026-04-09T19:53:21.690513+00:00",
    "lat": 39.3571027,
    "lng": 16.2317928,
    "name": "Capannone F",
    "source_id": "unical-campus-map",
    "source_url": "https://www.unical.it/campus/visita-il-campus/mappa/"
  },
  {
    "building_id": "capannone-g",
    "last_verified_at": "2026-04-09T19:53:21.690513+00:00",
    "lat": 39.3574501,
    "lng": 16.2314871,
    "name": "Capannone G",
    "source_id": "unical-campus-map",
    "source_url": "https://www.unical.it/campus/visita-il-campus/mappa/"
  },
  {
    "building_id": "capannone-h",
    "last_verified_at": "2026-04-09T19:53:21.690513+00:00",
    "lat": 39.3572261,
    "lng": 16.2319216,
    "name": "Capannone H",
    "source_id": "unical-campus-map",
    "source_url": "https://www.unical.it/campus/visita-il-campus/mappa/"
  },
  {
    "building_id": "capannone-i-cnr",
    "description": "Istituto CNR - IIA",
    "last_verified_at": "2026-04-09T19:53:21.690513+00:00",
    "lat": 39.3573412,
    "lng": 16.2319806,
    "name": "Capannone I - CNR",
    "source_id": "unical-campus-map",
    "source_url": "https://www.unical.it/campus/visita-il-campus/mappa/"
  },
  {
    "building_id": "capannone-l",
    "last_verified_at": "2026-04-09T19:53:21.690513+00:00",
    "lat": 39.3574439,
    "lng": 16.2327813,
    "name": "Capannone L",
    "source_id": "unical-campus-map",
    "source_url": "https://www.unical.it/campus/visita-il-campus/mappa/"
  },
  {
    "building_id": "cappella-universitaria",
    "last_verified_at": "2026-02-10T13:28:27.324220+00:00",
    "lat": 39.3615853,
    "lng": 16.2262273,
    "name": "Cappella Universitaria",
    "source_id": "unical-campus-map",
    "source_url": "https://www.unical.it/campus/visita-il-campus/mappa/"
  },
  {
    "building_id": "cedam-centro-di-educazione-e-documentazione-ambientale",
    "last_verified_at": "2026-04-09T19:53:21.690513+00:00",
    "lat": 39.3390698,
    "lng": 16.2432043,
    "name": "CEDAM - Centro di Educazione e Documentazione Ambientale",
    "source_id": "unical-campus-map",
    "source_url": "https://www.unical.it/campus/visita-il-campus/mappa/"
  },
  {
    "building_id": "centro-didattico-multifunzionale-centro-materia",
    "last_verified_at": "2026-04-09T19:53:21.690513+00:00",
    "lat": 39.3642552,
    "lng": 16.2274477,
    "name": "Centro didattico multifunzionale, Centro Materia",
    "source_id": "unical-campus-map",
    "source_url": "https://www.unical.it/campus/visita-il-campus/mappa/"
  },
  {
    "building_id": "centro-editoriale-librario",
    "last_verified_at": "2026-04-09T19:53:21.690513+00:00",
    "lat": 39.3572126,
    "lng": 16.2305108,
    "name": "Centro Editoriale librario",
    "source_id": "unical-campus-map",
    "source_url": "https://www.unical.it/campus/visita-il-campus/mappa/"
  },
  {
    "building_id": "centro-radiotelevisivo",
    "last_verified_at": "2026-04-09T19:53:21.690513+00:00",
    "lat": 39.3556385,
    "lng": 16.2253797,
    "name": "Centro Radiotelevisivo",
    "source_id": "unical-campus-map",
    "source_url": "https://www.unical.it/campus/visita-il-campus/mappa/"
  },
  {
    "building_id": "centro-sanitario",
    "description": "P11 - Parcheggio Unical aperto al pubblico",
    "last_verified_at": "2026-04-09T19:53:21.690513+00:00",
    "lat": 39.3634953,
    "lng": 16.2267932,
    "name": "Centro Sanitario",
    "source_id": "unical-campus-map",
    "source_url": "https://www.unical.it/campus/visita-il-campus/mappa/"
  },
  {
    "building_id": "centro-universitario-sportivo",
    "last_verified_at": "2026-04-09T19:53:21.690513+00:00",
    "lat": 39.3539493,
    "lng": 16.223529,
    "name": "Centro Universitario Sportivo",
    "source_id": "unical-campus-map",
    "source_url": "https://www.unical.it/campus/visita-il-campus/mappa/"
  },
  {
    "building_id": "cla-centro-linguistico-d-ateneo",
    "last_verified_at": "2026-04-09T19:53:21.690513+00:00",
    "lat": 39.3619711,
    "lng": 16.225963,
    "name": "CLA - Centro Linguistico d'Ateneo",
    "source_id": "unical-campus-map",
    "source_url": "https://www.unical.it/campus/visita-il-campus/mappa/"
  },
  {
    "building_id": "cubi-7-11b",
    "description": "Cubo 7-11B Uffici",
    "last_verified_at": "2026-04-09T19:53:21.690513+00:00",
    "lat": 39.3589972,
    "lng": 16.2267543,
    "name": "Cubi 7-11B",
    "source_id": "unical-campus-map",
    "source_url": "https://www.unical.it/campus/visita-il-campus/mappa/"
  },
  {
    "building_id": "cubi-8c-9c",
    "description": "Istituto CNR - ICAR",
    "last_verified_at": "2026-04-09T19:53:21.690513+00:00",
    "lat": 39.3586042,
    "lng": 16.2262755,
    "name": "Cubi 8C-9C",
    "source_id": "unical-campus-map",
    "source_url": "https://www.unical.it/campus/visita-il-campus/mappa/"
  },
  {
    "building_id": "cubo-0b",
    "description": "Dipartimento di Scienze Politiche e Sociali - Department of Political and Social Science",
    "last_verified_at": "2026-04-09T19:53:21.690513+00:00",
    "lat": 39.3564981,
    "lng": 16.2270454,
    "name": "Cubo 0B",
    "source_id": "unical-campus-map",
    "source_url": "https://www.unical.it/campus/visita-il-campus/mappa/"
  },
  {
    "building_id": "cubo-0c",
    "description": "Dipartimento di Economia, Statistica e Finanza \"Giovanni Anania\"",
    "last_verified_at": "2026-04-09T19:53:21.690513+00:00",
    "lat": 39.3564629,
    "lng": 16.226584,
    "name": "Cubo 0C",
    "source_id": "unical-campus-map",
    "source_url": "https://www.unical.it/campus/visita-il-campus/mappa/"
  },
  {
    "building_id": "cubo-11c",
    "description": "Dipartimento di Scienze Politiche e Sociali - Department of Political and Social Science",
    "last_verified_at": "2026-04-09T19:53:21.690513+00:00",
    "lat": 39.3589226,
    "lng": 16.2262111,
    "name": "Cubo 11C",
    "source_id": "unical-campus-map",
    "source_url": "https://www.unical.it/campus/visita-il-campus/mappa/"
  },
  {
    "building_id": "cubo-11d",
    "description": "Dipartimento di Scienze Politiche e Sociali - Department of Political and Social Science",
    "last_verified_at": "2026-04-09T19:53:21.690513+00:00",
    "lat": 39.3588976,
    "lng": 16.2259188,
    "name": "Cubo 11D",
    "source_id": "unical-campus-map",
    "source_url": "https://www.unical.it/campus/visita-il-campus/mappa/"
  },
  {
    "building_id": "cubo-12b",
    "last_verified_at": "2026-04-09T19:53:21.690513+00:00",
    "lat": 39.3592181,
    "lng": 16.226576,
    "name": "Cubo 12B",
    "source_id": "unical-campus-map",
    "source_url": "https://www.unical.it/campus/visita-il-campus/mappa/"
  },
  {
    "building_id": "cubo-12c",
    "description": "Dipartimento di Chimica e Tecnologie Chimiche",
    "last_verified_at": "2026-04-09T19:53:21.690513+00:00",
    "lat": 39.3591818,
    "lng": 16.2261656,